Marshall Islands,Marshall Islands | Data,http://data.worldbank.org/country/marshall-islands,"Marshall Islands from The World Bank: Data. ... 1960 1980 2000 Million 40 180 
Marshall Islands. Population, total. Details. 1960 1980 2000 Thousand 15 50 ..."
Marshall Islands,Marshall Islands - Open Data Inventory - Open Data Watch,http://odin.opendatawatch.com/Report/countryProfile/MHL?appConfigId=1,"Summary scores for 2015. Summary scores are weighted averages across 
twenty categories and ten elements. Scores within categories and elements are ..."
Marshall Islands,ODIN Country profile Marshall Islands - Open Data Inventory,http://odin.opendatawatch.com/Report/countryProfile/MHL?appConfigId=3,"Summary scores for 2016. Summary scores are weighted averages across 
twenty categories and ten elements. Scores within categories and elements are ..."
Marshall Islands,Country Report - Open Data Inventory,http://odin.opendatawatch.com/ReportCreator/ExportCountryReport?countryId=223&appConfigId=3,"General/Special Data Dissemination System (GDDS/SDDS) ... Marshall Islands 
ranks 158 in the Open Data Inventory 2016 with an overall score of 21%."
Marshall Islands,Marshall Islands - Global Open Data Index: Survey,http://global.survey.okfn.org/place/mh,"Dataset, Breakdown, Info, Year, Score, Admin. Government Budget. Government 
Spending. Election Results. Company Register. National Maps. National ..."
Marshall Islands,"Marshall Islands OpenStreetMap Tiles, GeoData and OpenData Maps",https://openmaptiles.com/downloads/marshall_islands,"Marshall Islands Map Tiles. Bounds: 160.494934, 4.274, 172.4737007, 14.973. 
Downloads. OpenStreetMap Purchase Schema: v3.4. Planet time: 2017-01-23."
Marshall Islands,"ODA | Marshall Islands General Government Revenue, % of GDP",https://www.quandl.com/data/ODA/MHL_GGR_NGDP-Marshall-Islands-General-Government-Revenue-of-GDP,"Marshall Islands General Government Revenue, % of GDP. ... where it is offered 
under an open data licence (www.opendataforafrica.org/legal/termsofuse)."
Marshall Islands,Marshall Islands and ADB | Asian Development Bank,https://www.adb.org/countries/marshall-islands/main,"Provides information on development assistance to Marshall Islands, economic 
data and analysis, the latest news and publications, and regional initiatives."
Marshall Islands,Marshall Islands - Nigeria Data Portal,http://nigeria.opendataforafrica.org/NBSNCI2016/capital-importation-statistics-of-nigeria-quarterly-update?region=1001580-marshall-islands,"Marshall Islands. ... FDI · Data National Bureau of Statistics, Nigeria Capital 
Importation Statistics of Nigeria, Quarterly Update Marshall Islands ..."
Marshall Islands,UNdata | country profile | Marshall Islands,http://data.un.org/CountryProfile.aspx?crName=marshall%20islands,"Marshall Islands ... Data classified according to ISIC Rev. 3. Employment: 
Agriculture (% of employed), 2010, 11.0, Data classified according to ISIC Rev. 3."
