Russian Federation,OPEN DATA RUSSIA: data.gov.ru,http://data.gov.ru/?language=en,"Добро пожаловать на Портал открытых данных Российской Федерации! 
Наш гид поможет вам ознакомиться с особенностями Портала и быстрее ..."
Russian Federation,Russian Federation | Global Open Data Index by Open Knowledge,http://index.okfn.org/place/russia/,The state of government open data in Russian Federation.
Russian Federation,Open Government Data in Russian Federation - arXiv,https://arxiv.org/pdf/1612.05164,"as well as open data initiatives and trends in Russian Federation. ... issues of 
Russian open government data movement are summarized and aggregated."
Russian Federation,Russian Federation | Data,http://data.worldbank.org/country/russian-federation,"Russian Federation from The World Bank: Data. ... 1960 1980 2000 Trillion 0.2 
2.2 Russian Federation. Population, total. Details. 1960 1980 2000 Million 120 ..."
Russian Federation,Russian Federation | Information and Communications for ...,http://blogs.worldbank.org/ic4d/miga/category/countries/russian-federation,"13 Mar 2015 ... Two years have passed since the World Bank's information and communications 
technologies (ICT) team conducted the world's first Open Data ..."
Russian Federation,Open Data for Economic Growth in Russia,https://openknowledge.worldbank.org/handle/10986/21320,"The report reviews the latest data about companies using open data, and 
highlights ... In addition to the release of data from Ministries of the Russian 
Federation ..."
Russian Federation,Federal Hackathon on Open Data - Data.gov.ru Hackathon №4,https://www.facebook.com/events/602765926561100/,"Federal Hackathon on Open Data - Data.gov.ru Hackathon №4. Public. · Hosted 
by Analytical Center for the Government of the Russian Federation. Interested ..."
Russian Federation,ODI St Petersburg: bringing you what's new in open data in Russia ...,https://theodi.org/blog/odi-st-petersburg-bringing-you-whats-new-in-open-data-in-russia,"15 Apr 2016 ... With open data gaining momentum in Russia, the team at ODI St Petersburg – a 
newly formed ... The Open Data portal of Russian Federation."
Russian Federation,Oleg Fomichev: Open data – new paradigm of national development,http://economy.gov.ru/en/home/press/news/2015111202,"11 Dec 2015 ... On December 10, State Secretary — Deputy Minister of Economic Development 
of the Russian Federation Oleg Fomichev took part in plenary ..."
