Belize,OpenDRI Belize,https://opendri.org/project/belize/,"As part of Belize's commitment to implement their national spatial data 
infrastructure, ... Belize has deployed an open data platform and continues to 
upload data."
Belize,Belize — Places - Caribbean Open Data Census,http://caribbean.census.okfn.org/place/bz,"Belize. This is the overview page where you can see the state of open data 
across each key dataset. Dataset, Score, Breakdown, Last Updated, Location (
URL) ..."
Belize,The Belize Elections - Open Data - ArcGIS,https://www.arcgis.com/home/item.html?id=501949bb6b554a1aa09e2372bc6bc7de,"Belize Elections Open Data. ... title: The Belize Elections - Open Data. description
: Belize Elections - Open Data. type: Web Mapping Application. tags: Belize ..."
Belize,Belize | Data,http://data.worldbank.org/country/belize,"1960 1980 2000 Billion 0.2 1.6 Belize. Population, total. Details. 1960 1980 2000 
Thousand 100 350 Belize. Gross enrollment ratio, primary, both sexes (%)."
Belize,"Belize OpenStreetMap Tiles, GeoData and OpenData Maps",https://openmaptiles.com/downloads/belize,"Download the entire planet, country or even city from the provided links below 
and use our vector tiles to get your job done."
Belize,Belize - Open Data Inventory - Open Data Watch,http://odin.opendatawatch.com/Report/countryProfile/BLZ?appConfigId=3,"Data Elements, Social Statistics, Economic Statistics, Environment Statistics, All ... 
47 Scores by Data Category Belize Central America Upper-middle income 0 ..."
Belize,ODIN Country profile Belize - Open Data Inventory,http://odin.opendatawatch.com/Report/countryProfile/BLZ?appConfigId=1,"Summary scores for 2015. Summary scores are weighted averages across 
twenty categories and ten elements. Scores within categories and elements are ..."
Belize,"iDB - Belize and SM2015 launch a digital tool to capture, score and ...","http://www.iadb.org/en/salud-mesoamerica-initiative/the-initiative/belize-and-sm2015-launch-a-digital-tool-to-capture-score-and-visualize-health-data-for-quality-improvement,18746.html","30 Ene 2015 ... The Ministry of Health of Belize and the Salud Mesoamérica 2015 Initiative ... to 
capture, score and visualize data over time for quality improvement. ... This open 
source app, Quality Improvement Analytics, was built for the ..."
Belize,Datasets | European Union Open Data Portal - Europa.eu,https://data.europa.eu/euodp/en/data/dataset?tags=Belize,"The EU Open Data Portal provides, via a metadata catalogue, a single point of ... 
Visualise this dataset with Preview of aid spendings and projects in Belize ..."
